{
  "id": "frm_primer_fwd",
  "kind": "DNA",
  "topo": "linear",
  "seq": "ATGCGTACCTGAACTT",
  "features": [
    {
      "type": "primer",
      "start": 1,
      "end": 16,
      "strand": "+"
    }
  ],
  "want": ["PCR amplification of insert"],
  "forbid": ["hairpin Tm > 65C"],
  "phase": "spec"
}
